{
  "$schema": "https://json-schema.org/draft/2020-12/schema",
  "$id": "https://solar.local/schemas/evidence/code_evidence_map.v1.schema.json",
  "title": "Solar Evidence ABI - Code Evidence Map",
  "type": "object",
  "required": ["schema", "task_id", "sprint_id", "node_id", "status", "inputs", "outputs", "artifacts", "provenance", "limitations"],
  "additionalProperties": false,
  "properties": {
    "schema": {"const": "code_evidence_map.v1"},
    "task_id": {"type": "string", "minLength": 1},
    "sprint_id": {"type": "string", "minLength": 1},
    "node_id": {"type": "string", "minLength": 1},
    "status": {"$ref": "#/$defs/status"},
    "inputs": {"type": "object", "additionalProperties": true},
    "outputs": {
      "type": "object",
      "required": ["mappings"],
      "additionalProperties": true,
      "properties": {
        "mappings": {"type": "array", "items": {"$ref": "#/$defs/mapping"}}
      }
    },
    "artifacts": {"type": "array", "items": {"$ref": "#/$defs/artifact"}},
    "provenance": {"$ref": "#/$defs/provenance"},
    "limitations": {"type": "array", "items": {"type": "string"}}
  },
  "$defs": {
    "status": {"type": "string", "enum": ["completed", "failed", "inconclusive"]},
    "artifact": {
      "type": "object",
      "required": ["type", "path"],
      "additionalProperties": false,
      "properties": {
        "type": {"type": "string", "minLength": 1},
        "path": {"type": "string", "minLength": 1},
        "sha256": {"type": "string", "pattern": "^[A-Fa-f0-9]{64}$"}
      }
    },
    "provenance": {
      "type": "object",
      "required": ["operator_id", "implementation_package", "timestamp"],
      "additionalProperties": true,
      "properties": {
        "operator_id": {"type": "string", "minLength": 1},
        "implementation_package": {"type": "string", "minLength": 1},
        "timestamp": {"type": "string", "format": "date-time"}
      }
    },
    "mapping": {
      "type": "object",
      "required": ["mapping_id", "claim_id", "repo_or_path", "files", "evidence_ids"],
      "additionalProperties": true,
      "properties": {
        "mapping_id": {"type": "string", "minLength": 1},
        "claim_id": {"type": "string", "minLength": 1},
        "repo_or_path": {"type": "string", "minLength": 1},
        "files": {"type": "array", "items": {"type": "string", "minLength": 1}},
        "execution_entrypoint": {"type": "string"},
        "evidence_ids": {"type": "array", "items": {"type": "string", "minLength": 1}}
      }
    }
  }
}
